{
  "dataset_version": "015.eval.1",
  "frozen": {
    "budget": "015.budget.1: AOEP cases consume no model or consolidation budget - rollback, retire, purge and access are deterministic authority-log operations; the builtin generic domain memory_policy defaults apply (per_scope_memory_quota=5000, decay_rate=.05, consolidation disabled)",
    "clock": "2026-10-09T13:25:00+00:00",
    "implementation": "c423c8dd8210b5a99a870f1f19b62970fcadec0e",
    "model": "BAAI/bge-m3 (dense memory projection only; no LLM participates in any AOEP machine criterion)",
    "policy": "015.memory_policy.1: builtin generic DomainProfile defaults; no consolidation_enabled, no promotion, no lifecycle grant",
    "prompt": "none - no prompt, distiller or model call is part of any AOEP case",
    "recall": "015.aoep.recall.1: consumption surfaces are recall(scope_ref=[...]) plus the live manifest/inspect() report; per-projection denominators are read from the live reducer state of the current manifest",
    "schema": "urn:rag-mcp:015:aoep-obligation-dataset:1",
    "snapshot": "015.eval.1 cases array (sha256 of the canonical cases array; pinned in snapshot_hash, recomputable with tests.memory_eval_datasets.frozen_subset_hash)",
    "vocabulary": "015.aoep.vocabulary.1: projections relation/dense/links/summary/file (+ field projection salience, excluded from deletion propagation); error codes MISSING_KNOWLEDGE_SCOPE/AMBIGUOUS_DOMAIN_REF/MEMORY_ROLLBACK_FORBIDDEN/MEMORY_WRITE_UNAVAILABLE/MEMORY_EVIDENCE_ANCHOR_REQUIRED; authority event types assert/revise/access/retract/rollback"
  },
  "snapshot_hash": "a5ad2d6c7ac6c1af376484ede46adea70eb82837796c28174095101229e66ba4",
  "scope_id": "c015-eval-aoep-isolated",
  "isolation": {
    "mode": "per_run_dedicated",
    "identity": "per_run_dedicated",
    "forbidden_scope_ids": [
      "366084747748704256"
    ],
    "disposal": "record_and_dispose",
    "record_isolation_id": true
  },
  "invariants": {
    "traceable_rollback": {
      "min_cases": 2,
      "machine_criterion": "R6.1",
      "statement": "回滚可溯：回滚事件存在且 request_id 与治理响应一致、事件链闭合（回放 id 序列与权威日志逐项相等、无缺失、无重复——event_id 为 snowflake，MUST NOT 实现为数值连续性）、水位可读、全状态与逐投影指纹一致、影响面计数一致、可再次回滚到相邻检查点、access 事件保留"
    },
    "deletion_propagation": {
      "min_cases": 2,
      "machine_criterion": "R6.2",
      "statement": "删除传播：retire 与 purge 两形态后对关系/向量/链接/摘要/文件五类投影各自独立断言『该条可消费命中数 = 0』且各自分母非零；权威日志保留 retract 事件与来源链（content_text/content_hash 仍在）；salience 为字段投影，不参与本断言"
    },
    "authority_monotonicity": {
      "min_cases": 2,
      "machine_criterion": "R6.5",
      "statement": "权威单调：越权写入（声明超出写入者权威 / 非写实例 / 只读实例）与经 MCP 面改写绑定表的尝试全部被拒（403 或结构化错误）；拒绝前后权威日志 id 序列逐项相等、authority 轴取值不变、绑定表行集不变，且每次拒绝均可在响应错误码或权威日志中观测到"
    },
    "provenance_preservation": {
      "min_cases": 2,
      "machine_criterion": "R6.6",
      "statement": "来源保全：retire/purge/rollback 状态转移后 provenance 元数据与来源链保留，content_hash 可复算且重算值与记录值逐项相等（不得仅『字段存在』），权威日志保留墓碑/retract 事件与来源链且历史未被物理回删，受影响投影经 projection_fingerprint 复算一致"
    },
    "scope_non_expansion": {
      "min_cases": 2,
      "machine_criterion": "R6.4",
      "statement": "范围不扩张：歧义引用与缺失/空（空串与只含空白）scope 引用一律被拒并给出候选域（AMBIGUOUS_DOMAIN_REF / MISSING_KNOWLEDGE_SCOPE），『回落最近域/全库』成功次数 = 0，拒绝留审计；缺失≠歧义，两类各自构造用例、各自给出非零样本量、分别记分"
    }
  },
  "cases": [
    {
      "case_id": "aoep_traceable_rollback_event_point",
      "invariant": "traceable_rollback",
      "target_kind": "event_point",
      "requires_re_rollback": true,
      "projections_asserted": [
        "relation",
        "dense",
        "links",
        "summary",
        "file"
      ],
      "expected": {
        "outcome": "passed"
      },
      "_meta": {
        "review_status": "reviewed",
        "review_notes": "R6.1 with an event-point target and the re-rollback requirement. Machine program: the authority log holds an event with event_type=rollback whose request_id equals the governance response request_id; the event chain is closed as replay(scope) ids == authority ids item by item, no missing and no duplicate (explicitly NOT numeric continuity - event_id is a sparse snowflake); the rollback event payload event_point is consistent with memory_projection_meta.source_event_id before and after; before/after_fingerprint equal the independently recomputed projection_fingerprint(reduce_events(replay)); every per-view fingerprint equals the MemoryProjectionMeta.fingerprint written at projection_fingerprint(state[view]); inspect() reports matches_replay for all six views; impact.memory_ids equals the entries diff; a second rollback to an adjacent checkpoint is self-consistent; access events are retained.",
        "grounded_source": "specs/015-memory-evaluation-governance/research.md R6.1 + R6 澄清段; quickstart.md VS-04; services/memory_governance.py:119-125,180-182; services/rollback_service.py:2-20; services/memory_projection_store.py:232,285-367; runtime/projection_rebuild.py:143-146",
        "rollback_target": "event_point",
        "negative_control": false
      }
    },
    {
      "case_id": "aoep_traceable_rollback_time_point_re_rollback",
      "invariant": "traceable_rollback",
      "target_kind": "time_point",
      "requires_re_rollback": true,
      "projections_asserted": [
        "relation",
        "dense",
        "links",
        "summary",
        "file"
      ],
      "expected": {
        "outcome": "passed"
      },
      "_meta": {
        "review_status": "reviewed",
        "review_notes": "R6.1 with a time-point target: the target is the ISO occurred_at of the first assert, and RollbackService folds it to the last event with occurred_at <= time_point; every other sub-condition of R6.1 is measured identically to the event-point case, plus the re-rollback to an adjacent checkpoint.",
        "grounded_source": "specs/015-memory-evaluation-governance/research.md R6.1; quickstart.md VS-04; services/rollback_service.py:10-16",
        "rollback_target": "time_point",
        "negative_control": false
      }
    },
    {
      "case_id": "aoep_traceable_rollback_audit_only_counterexample",
      "invariant": "traceable_rollback",
      "target_kind": "action",
      "projections_asserted": [
        "relation"
      ],
      "expected": {
        "outcome": "passed"
      },
      "_meta": {
        "review_status": "reviewed",
        "review_notes": "Negative control for the R6.1 checker (quickstart.md VS-04 反例): a real MemoryManagementAudit row written by an actual management rebuild supplies a queryable request_id while the authority log holds no event carrying that request_id and no rollback event at all. The R6.1 checker MUST judge that audit-only reference failed; this case is passed only when the checker returns failed, i.e. the checker cannot be satisfied by an audit record alone.",
        "grounded_source": "specs/015-memory-evaluation-governance/quickstart.md VS-04 反例; services/memory_service.py:858-864 (audit row is written by rebuild only, with no authority event); research.md R6 rationale",
        "rollback_target": null,
        "negative_control": true
      }
    },
    {
      "case_id": "aoep_deletion_propagation_retire",
      "invariant": "deletion_propagation",
      "target_kind": "action",
      "projections_asserted": [
        "relation",
        "dense",
        "links",
        "summary",
        "file"
      ],
      "expected": {
        "outcome": "passed"
      },
      "_meta": {
        "review_status": "reviewed",
        "review_notes": "R6.2 via retire (event_type=retract, no purge marker). The entry is recorded with evidence_refs so relation/dense/links/summary/file each have a non-zero denominator measured from the live manifest state; after the tombstone each of the five projections is asserted independently to have a consumer-visible hit count of 0 for that identity, the authority log still holds the retract event and the original content_text/content_hash, and salience is excluded as a field projection.",
        "grounded_source": "specs/015-memory-evaluation-governance/research.md R6.2 + 分母纪律; quickstart.md VS-05; services/memory_reducer.py:266-268,374-393; services/memory_governance.py:110-113",
        "deletion": "retire",
        "salience_excluded": true
      }
    },
    {
      "case_id": "aoep_deletion_propagation_purge",
      "invariant": "deletion_propagation",
      "target_kind": "command",
      "projections_asserted": [
        "relation",
        "dense",
        "links",
        "summary",
        "file"
      ],
      "expected": {
        "outcome": "passed"
      },
      "_meta": {
        "review_status": "reviewed",
        "review_notes": "R6.2 via purge (event_type=retract with payload.purge=true). Identical five-projection scoring and non-zero denominator construction as the retire case; the purge marker must be observable in the tombstone event.",
        "grounded_source": "specs/015-memory-evaluation-governance/research.md R6.2; quickstart.md VS-05; services/memory_governance.py:112-113; services/memory_reducer.py:266-268",
        "deletion": "purge",
        "salience_excluded": true
      }
    },
    {
      "case_id": "aoep_authority_monotonicity_rejects_escalation",
      "invariant": "authority_monotonicity",
      "target_kind": "command",
      "expected": {
        "outcome": "passed"
      },
      "_meta": {
        "review_status": "reviewed",